textId,index,content
i_cd112d8620c3,204,かつて、日本のサラリーマンといえば、朝早く家を出て家に帰るのは深夜になり、残業や休日出勤をするのは当たり前でした。近年、週休二日制の導入や労働時間を減らす取り組みなどが実施され、サラリーマンの生活は変化してきました。
i_f6b29ea9926a,204,週休二日制は1980年代から企業に導入されてきました。1992年には国家公務員に、2002年には小中学校にこの制度が導入されました。2005年の調査によると日本の企業の89%が、週休二日制を実施しています。
i_1c732a93bfa5,204,更に、フレックスタイム制度を導入する会社も増えています。これは、自分の出勤と退勤の時間を自由に決められる制度です。労働者が自分の生活と仕事のバランスを取りながら、働くことができるように設けられました。
i_384c8dacf323,204,また、日本の会社には、育児休暇の制度がありますが、これまでこの制度を利用するのは、ほとんどが女性でした。男性の場合、会社での理解が得られないのではないか、出世の妨げとなるのではないかと考える人が多かったからです。近年、家族との時間を大切にしたいと考えて、この制度を利用する男性が見られるようになりました。
i_93f866ec1406,204,このように、日本のサラリーマンの働き方は、かつてと比べると大きく変化しています。都会での時間に追われる生活を止めて、田舎に引越す人もいます。
i_5d6f09f5fd89,205,「金星」が日本で販売されたのは、10年前です。最初は中々売れなくて苦労しましたが、3年前、コンテストで最高賞を受賞したのをきっかけにして、売れるようになりました。
i_1a1da92967b3,205,最近では、海外からの注文も増えてきています。
i_cb3bc37af61a,205,ところで、「金星」という名前は、中国人に受けるでしょうか。日本と中国とでは、意味の違う漢字があると聞きましたが。
i_22377da2207c,205,この言葉は中国語でも同じ意味ですから、大丈夫ですよ。
i_ebc0520365fe,205,でも、「きんぼし」と読むと、意味が違いますよね。
i_d8db5633b8b5,205,「きんぼし」と「きんせい」は意味が違うんですか。
i_8aad2b3bdaa4,205,ええ、「金星」は星の名前ですが、「金星」というのは、「素晴らしい働きをすること」を表します。相撲で位の低い力士が横綱に勝った時に「金星を上げる」ということから来た言葉です。
i_e4f67a7dc308,205,そうですか。相撲から来た言葉ですか。このお酒も金星を上げられるようにしたいですね。
i_fbc5e41e5136,205,話は変わりますが、「金星」って、ボトルの形が素敵ですね。丸でワインのボトルみたいです。
i_899dfeaf57f6,205,有難うございます。特にこのデザインは若者に人気があるんですよ。
i_e6fee30a2445,205,このボトルなら、中国でも売れるのは間違いないですね。
i_f89b021b2cc9,205,それを聞いて安心しました。
i_804e9d1d6bf8,205,日本語の単語を、元の言葉は何かという点から分類すると、「和語」「漢語」「外来語」「混種語」の四つに分けることができる。和語はもともと日本語にあった言葉で、漢語は中国語から取り入れられた言葉だ。漢語は「音読み」する。音読みとは、昔の中国語の発音に基づいた読み方だ。外来語は主に19世紀以降、西洋を中心とした外国から取り入れられた言葉で、普通片仮名で書く。更に、和語、漢語、外来語のうち、二つ以上を組み合わせてできた言葉を混種語と呼ぶ。「消しゴム」や「マラソン大会」「正月休み」などの言葉だ。
i_17126fc139cf,205,同じ漢字で表される言葉でも、漢語か和語かで意味が違うことがある。例えば「生物」という言葉は、漢語として「せいぶつ」と読むと、動物や植物の総称となるが、和語として「なまもの」と読むと、煮たり焼いたりしていない食べものという意味になる。だから「生物を食べる」という文を「せいぶつをたべる」と読むと、意味がよく分からなくなってしまう。
i_76e9c40e7cf8,205,漢語、和語に外来語が加わると、更に意味の違いが出てくる。例えば、宿泊施設をいう場合、「旅館」というと、大抵の人は、畳の上に布団を敷いて寝るような部屋を想像する。一方、「ホテル」というと、ベッドで寝る部屋を想像することが多い。
i_731f31c9f186,206,竜虎酒造の佐藤さんなんだけど、何と僕の大学の先輩だったんだ。
i_a342d2a5d7c5,206,えっ、先輩？あの佐藤さんが？
i_2002909f073a,206,そう。バスケットボール部の2年先輩。四年生の時はキャップテンだったんだよ。
i_c96a90c32fc8,206,ふうん。じゃあ、人気があったんでしょうねえ。
i_39c0a38226a5,206,それはもう。真面目だし、皆から信頼されていたしね。
i_33b43c49ce6b,206,あっ、王さん、今からお昼？今日は遅いんだね。
i_195048df43d1,206,打ち合わせが長引いちゃって。何の話してたの？
i_aab56a33194c,206,竜虎酒造の佐藤さんのことを話していたんだ。あの人、僕の大学の先輩なんだよ。
i_c056351be1db,206,へえ、そうだったの。
i_55aedb4914da,206,そういえば、佐藤さんに李さんのことを聞かれたな。どんな人だって。
i_ef86d7584262,206,それで、中井さんは何て言ったの？
i_9c6aff614bd3,206,うん。明るくて、仕事熱心な人だって言ったよ。部下の面倒をよく見るし、優しいし、正に理想的な上司で、…。
i_7717b4b2ef7b,206,そんなことを聞くということは、佐藤さん、李さんのことが気になるのかしら。
i_9999500b2a02,206,うん、そうかもね。
i_9fb72c1631f4,206,手、箸、フォーク、ナイフ、スプーンなど、食べる時に何を使うかは、食事の内容や習慣によって違う。
i_34afecc8205f,206,日本では、洋食はナイフとフォーク、スプーンで食べ、和食は、箸を使う。中国や韓国では、スープをスプーンや蓮華を使って食べるが、日本の味噌汁は、お碗を持ち上げ、直接口を付けて食べる。具を食べる時は勿論箸を使う。
i_5e8693b9511c,206,「箸」といっても、その形や材料は国や地域によって違う。中国の箸は長くて、先端が丸く太さが余り変わらない。材料は木や竹、プラスチックのほか、玉や金属のものもある。韓国の箸は中国より少し短く、稍平らな形をしている。ステンレスなど、金属製のものが一般的だ。日本の箸は韓国のものに比べて更に短く、先の方は細くなっていて、尖っている。材質は木や竹が多く、漆が塗られていることもある。
i_84647c81e639,206,日本の家庭では、自分専用の箸や茶碗を使う。食事は1人1人、お皿や茶碗に分けて出されるのが一般的だが、大皿から料理を取る時は、取り箸を使うのが、正式なマナーだとされる。
i_bf5adc9aa0e6,206,食事の時に箸を使うのは、中国、韓国、ベトナム、日本などで、世界の人口の約3割だというが、同じ「箸を使う」文化も、実に様々だ。
i_d14047508eff,207,中井さんの企画は、テレビCMね。「燕醸造のCMを参考にする」と書いてあるけど、これはどういう意味？
i_ab1cb88c7922,207,日本の清涼飲料水のCMなんですが、制作スタッフが中国人なんです。屹度参考になるだろうと思います。
i_4de4fb708335,207,ああ、あの評判のCMね。確かに中国人の感性がよく分かるわ。それから、野田さんの「創作中華料理コンテスト」という企画はどういうもの？
i_35a6d668e494,207,はい。「金星」に合う創作中華料理を募集するんです。コンテストはパーティー形式にして、有名な歌手や俳優に審査員として参加してもらいます。
i_1652539c129c,207,コンテストをパーティー形式に？
i_333a6ad5b06a,207,はい。選考会の会場は、上海ならノーストンホテル、北京なら華晶酒店を考えています。
i_83e4a264cdcd,207,ノーストンホテルと華晶酒店？どちらも最高級の場所よ。
i_041612553c51,207,ええ。高級ホテルとスター。屹度話題になるだろうと思います。
i_64c2dc33d381,207,なるほど、それなら、テレビに取り上げてもらうこともできるわね。
i_3a718532dabd,207,では、企画会議までに、それぞれの案をできるだけ具体的に纏めてください。
i_1fcc29579f3a,207,企画会議は来週の何曜日でしたっけ？
i_bc49bede159d,207,木曜日です。
i_ff7991d58c0c,207,件名(Subject)：「金星」キャンペーンの企画案
i_cb80c53806c4,207,竜虎酒造株式会社「金星」販売促進企画部
i_49ab9ae8e24d,207,佐藤光一様
i_a6768ac04251,207,いつもお世話になっております。JC企画の王です。
i_55d675d50a4d,207,先日お話しました「金星」キャンペーンの企画案ができました。
i_fe65b6efc5aa,207,できるだけ早くご説明に伺いたいと思います。
i_e3770a34f093,207,来週のご予定はいかがですか？ご都合のいい時間をお知らせください。
i_2db2ac778bd7,207,宜しくお願い申し上げます。
i_425663d76287,207,株式会社JC企画上海支社
i_c5d8948e7b77,207,王風wangf@jckikaku.cn
i_4c8ff09955ee,207,メールは手軽な連絡の手段として、世界中で使われている。ただし、仕事の上でのメールや目上の人に送る場合は、いくつか気をつけなければならないことがある。注意点さえ理解しておけば、メールはとても便利なコミュニケーションの手段だ。
i_0dc196865307,207,1.件名を書く時は、用件を明確にする
i_4862bcceaa53,207,「こんにちは」「はじめまして」などという、メールの内容が分からない表現は避け、件名だけで内容が分かるようにする。
i_acad3226eec3,207,2.宛先と自分の名前を忘れずに入れる
i_49eeacc2f4a2,207,会社名や部署が分かっている場合は、「~株式会社~部」のように宛先を書き、相手の名前が分かっている場合は、文の初めに「○○様」と相手の名前を入れるといい。
i_ed6e68af9b6f,207,3.用件は簡潔にする
i_b0215daa9b98,207,要点を整理して、伝えたいことを簡潔に書く。1行は30文字ぐらいで改行し、3~4行每に1行空けると読み易い。
i_7eafbe86b13e,207,4.最後に署名を入れる
i_b771bc70c3b6,207,文の最後には、普通、自分の名前、所属する会社、部署やメールアドレスなどを書いた「署名」を付ける。
i_438b0a9549f0,208,先日の話では、「金星」は特に若者に人気がある、ということでしたが…。
i_368e0b9b54ae,208,ええ、その通りです。
i_39f89f2ab599,208,それで考えたんですが、中国でも「金星」のキャンペーンのターゲットを都市部に住む若者に絞ってはどうでしょう。
i_bf0fc443b38a,208,うん。それはいいかもしれませんね。
i_b50f4b7391d9,208,更に、キャンペーンでは、CM、ホームページ、イベントの3つに力を入れたいと思います。
i_24fc535fa643,208,ほう、CMとホームページは分かりますが、イベントというのはどんなものですか。
i_1aba000668a4,208,「創作中華料理コンテスト」と「金星」試飲会などを考えています。イベントは、ホテル、レストランなどで行います。詳しい内容については、企画書をご覧ください。……
i_52cde496e5c3,208,それから、ホームページの件ですが、「『金星』の故郷を探る」というコーナーを設けてはどうでしょうか。
i_3c5e5705b641,208,「『金星』の故郷を探る」ですか。
i_a4c78f7aab1a,208,はい。商品のPRだけじゃなくて、日本の文化を紹介するコーナーを作ってはどうかと考えています。日本の食べものとか若者の意識とかを紹介するのも面白いと思うんですが。
i_0c7f94645616,208,なるほど、いいですね…。では、王さん、取材に行ってみませんか。
i_d58436cdf123,208,えっ、私がですか？
i_4a05f5c0b238,208,ええ。日本人でも、もちろんそのような記事は書けます。でも、中国人の目から日本を取材したほうが、面白い記事になると思うんです。
i_5f8649286d77,208,分かりました。では、まず会社に帰って、上司と相談させてください。
i_dce759924bb6,208,カップラーメンは、お湯を注いで3分待つだけで、どこでも手軽に食べられる。
i_702b2119dcd5,208,現在、世界中で愛されているカップラーメンを開発したのは、日清食品の創業者、安藤百福だ。1958年にインスタントラーメンを開発した安藤は、既にこの時期、『インスタントラーメンの国際化』という夢を持っていた。
i_73d232b7c122,208,ある年、安藤はキャンペーンのためにアメリカを訪れ、インスタントラーメンを試食してもらった。すると、相手は丼を使う代わりに紙コップを使い、その中に砕いたインスタントラーメンを入れ、お湯を注いで、フォークで食べ始めた。
i_5eceb417fe94,208,安藤はこれに驚き、「フォークの文化圏では、インスタントラーメンもフォークで食べられるようにしなければいけない」「丼に代わる新しい容器が必要だ」と考えた。そして、新しい味を丼ではない新しい容器で販売し、フォークで食べられるようにすれば、インスタントラーメンは国際{商品|こくさいしょうひん}になると確信した。
i_82ad56a884e1,208,しかし、開発は簡単ではなかった。容器の材料は、ガラス、紙、プラスチック、金属と、当時考えられるだけのものが集められた。様々な工夫の末、「発泡スチロール」が採用された。容器の形についても試作が繰り返された。片手で持てて、手から滑り落ちない形を理想として、現在の形が生まれた。
i_dca00afab5b4,208,こうして、カップラーメンは1971年に発売された。様々なキャンペーンが行われ、今では世界中に広がり、80か国以上の国で食べられている。
i_07c41e14f3a6,209,あのう、荷物が出て来ないんですけど…。
i_1a68d348dd09,209,えっ、そうですか。失礼ですが、どのようなお荷物ですか。
i_498fa1d80e15,209,黒いスーツケースで、「王風」という名札が付けてあります。いくら待っても出て来ないんですよ。
i_04b37537ac75,209,申し訳ありません。すぐにお調べします。少々お待ちください。
i_d1d4ec510bd6,209,すみません。AJL205便で来る人を待っているんですが、まだ出て来ないんです。
i_0bf53f5d48ba,209,上海からの便ですね。予定通り17時30分に到着いたしましたが…。宜しければ、お呼び出しのアナウンスをいたしましょうか。
i_6b13b620a838,209,ええ、お願いします。
i_967e170ebc69,209,ちょっと、一体いつまで待てばいいんですか。もう6時間ですよ。
i_13caeffc1f2a,209,申し訳ございません。只今お調べしております。もう少しお待ちいただけませんか。
i_c473a853dcc4,209,そんな、困りますよ。ロビーで同僚が待っているんです。早くしてもらえませんか。
i_5a94abad57c1,209,本当に申し訳ございません。後ほど、お泊まりのホテルにお届けいたします。宜しいでしょうか？
i_fb6c6bec96d9,209,仕方ないですね。できるだけ早く届けてくださいよ。
i_d81f5b7e356d,209,[resource:img:209-article-01.png]
i_594768e5ac42,209,4月1日17時20分、憧れのローマに到着。荷物を受け取って、入国。旅行社の人が迎えに来ているはずだが、見つからない。もし来なかったらと思い、不安になった時、背の高い男性が、にこにこしながら近づいて来て何か言う。誰かと思ったら、我々を迎えに来たガイドさんだった。
i_f632917d6e51,209,4月2日6時30分起床。今日はローマ市内観光。お土産物屋さんは、私たちの顔を見ると、まず「ニーハオ」と呼びかけ、黙っていると、「アンニョンハシムニカ」。更に黙っていると、「こんにちは」。海外旅行に来る東洋人は中国、韓国、日本の順になっているのだろうか。
i_865de1261a02,209,4月3日ポンペイ見学。西暦79年に火山の爆発で埋まってしまったローマ時代の都市だ。1900年以上も昔にこんな立派な都市があったなんて、信じられない。
i_12de5e115cf6,209,4月4日今日は自由行動。レストランに入ったら、イタリア語ばかりが聞こえてきて、ちょっと緊張する。隅に日本人らしいグループがいたので、何と無くほっとする。軽くお辞儀をすると、にっこり笑って、「ニーハオ」と言った。相手も私たちと同じ気持ちだったらしい。やはり同じ東洋人ということで、相通じるものがあるのかもしれない。
i_487ff5c3e4d4,210,今日から一週間、宜しくお願いします。
i_90d52be971f2,210,こちらこそ、お世話になります。スケジュール表、ありがとうございます。
i_d8ca7e629c18,210,滞在期間中、できるだけたくさんの取材ができるよう予定を立てました。ちょっとハード過ぎますか。
i_a5d978920ed8,210,いいえ、とんでもありません。音楽、ファッション、映画、食べ物、観光地…どれも関心のある所ばかりです。
i_9c4054adccc1,210,それから、水曜日だけは予定を入れていません。もしよかったら、その日、有馬温泉に寄ってみませんか。
i_c63894eff839,210,温泉ですか。
i_c23878b12153,210,ええ。1日くらいのんびりしたほうがいいと思って…。
i_2e0900271f21,210,ありがとうございます。ぜひ行ってみたいです。
i_36211654f6dd,210,わかりました。じゃあ、早速旅館を予約します。
i_286dfeca53d6,210,お電話ありがとうございます。「有馬旅館」でございます。
i_2d5d34a7d970,210,すみません、予約をお願いしたいんですが…。
i_3031af46066b,210,はい、ありがとうございます。ご予定はいつになりますか。
i_48fb19933e35,210,あさって、2名で1泊なんですが、空いているでしょうか。
i_fa332f7de1c2,210,はい、20日の水曜日、2名様で、ご1泊ですね。少々お待ちくださいませ。はい、ご用意できます。1泊2食付きで、お1人様16000円になりますが、宜しいですか。
i_9805e7e5a1a6,210,はい、結構です。
i_6beae477d3cb,210,かしこまりました。それでは、お名前とお電話番号をお願いします。……
i_fbb9aec9e1ec,210,日本には、全国に約3000の温泉地があり、利用者は1年間に延べ1億4千万人以上と言われている。
i_bc102050d015,210,温泉と言えば、地中から湧き出る温かいお湯のことだと思っている人も多い。しかし、冷たい水でも、規定の成分を含んでいれば温泉と言う。温泉の色は、透明なものから白い濁ったものや青色をしたものまで様々である。また、成分の違いによって、神経痛や皮膚病、高血圧など色々な病気に効くと言われている。
i_a2f4cfc0fe95,210,かつて、温泉は病気や怪我の治療に使われていた。今は、環境を変えてのんびりするために利用する人がほとんどだ。温泉の多くは自然の豊かな場所にある。だから、緑を見ながら、露天風呂に入ったり、広いお風呂でたっぷりのお湯に浸かったりすることによって、リラックスできるのだろう。
i_4cdc86b099fc,210,温泉地では、お客を集めるための工夫をしている。例えば、宿泊する人以外がホテルや旅館の入浴施設を有料で使用できる「日帰り温泉」がある。「入浴+昼ご飯」や、「入浴+部屋での休憩」など、宿泊する時間のない人のために様々なプランもある。最近では「日帰り入浴」専用の施設も増えてきている。
i_bc8962044f44,210,また銭湯と言って、安い値段で入浴できる施設もある。銭湯とは、多くの家にお風呂がなかったころに作られた入浴施設のことだ。現在ではその数も少なくなってきているが、最近では「スーパー銭湯」が出てきて人気を集めている。普通の銭湯より値段は高いが、色々な種類のお風呂やマッサージ、エステなどがあり、一日中楽しめる。「スーパー銭湯」は忙しい人たちのちょっとした癒しの場になっているのだ。
i_67ef0f1be616,211,あのポスター、張一心ですね。
i_7a25c26c7a6b,211,ええ。新作映画の「朋友」が今週公開されたばかりです。興行成績は現在のところ第2位ですが、来週はトップになる見込みです。
i_021d95dee8fd,211,張一心は中国では大スターですが、日本でも凄い人気があるんですね。
i_48c6e9cad7d1,211,はい。彼が主演する映画は、アクションでも恋愛ドラマでも、必ず当たります。
i_d9c2046b7a7f,211,中国映画の人気はどうなんですか？
i_747564803fbb,211,ええ。この1か月で3本の中国映画が公開されました。どれも高く評価されています。
i_0019f2a84701,211,中国以外ではどの国の映画が人気があるんですか。
i_1d46e29305ce,211,アメリカや韓国…そうそう、日本映画の人気も高まっていますよ。
i_d0a1a54eb415,211,そうすると、外国のものだから人気があると言う訳ではないんですね。
i_7581ef428f30,211,ええ、若者は日本のものと外国のものを区別していないような気がします。彼らは、映画にしても音楽にしても、いいものならすぐに受け入れます。
i_47531b4f30f7,211,そうですね。中国の若者も同じだと言う気がします。じゃあ、彼らの心をつかむには、どうすればいいんでしょうか。
i_946eb627bfd8,211,うーん…難しい質問ですね。やはり本当にいいものを作ることではないでしょうか。
i_4e43d9390ead,211,本当にいいもの、ですか？
i_81b8a85170b0,211,ええ。今の若者は、テレビCMより、同じ世代の人の口コミを信じます。映像でも音楽でも食べ物でも、本当にいいものを提供すれば、口コミで広がっていくはずです。
i_47176b84d8bf,211,なるほど。ありがとうございます。とても参考になりました。
i_17f98b0a82b9,211,日本に来た外国人は、電車などでサラリーマンが夢中になって漫画を読んでいる光景を見て驚くと言う。日本の漫画は、子供向けから成人向けまで、対象の年代每に様々な種類がある。会社員の生活や、経済に関するものなど、大人にしか楽しめない内容の漫画も多くある。一方、子供向けの漫画でも、大人が楽しめるものも多い。近年、中国では「クレヨンしんちゃん」「ドラえもん」「ちび丸子ちゃん」などの漫画が子供だけでなく大人からも人気を集めている。
i_5da86a8e3c02,211,日本のテレビアニメも外国での評価が高い。日本で最初のテレビアニメは1963年の「鉄腕アトム」だ。漫画をアニメ化したものだが、その画質は今とは比べものにならないほど悪かった。その後、デジタル技術の開発が進むと共に、高画質の生き生きとした映像が生み出されるようになった。「ドラえもん」「クレヨンしんちゃん」などの漫画も、テレビ番組ようにアニメ化され、高視聴率を獲得した。
i_a0b5f95c3c91,211,やがて、最先端のデジタル技術を使ったアニメが映画館のスクリーンに登場し、娯楽性や芸術性の高い作品が次々に製作されるようになった。
i_eeca952748da,211,2001年に公開された「千と千尋の神隠し」は、その豊かな想像力と高い表現力が世界的にも高く評価された。
i_95a8822839ee,212,いよいよ明日帰国ですね。次の取材は、2週間後でしたよね。
i_a72cf79a61ac,212,はい。1週間お世話になりました。やっぱり、実際に来てみないと、分からないことがあるものですね。
i_5c805773769c,212,というと？
