textId,index,content
i_fabdc9791ccb,129,そうですか。中国語でも親しい相手には，“来，来！”“别客气！”と言って“请”を付けませんから，同じですね。
i_21c0c782fed7,129,そうですね。それから，野球場で女の人が「頑張れ！」と言うのを聞きました。
i_a24fbb363689,129,危険な時や丁寧に言う暇がない時は使ってもいいんです。
i_e479beb8e9fe,130,もう11時だから寝よう。
i_b4cbb4a5c8da,130,今日，会社を休もうと思います。
i_ab333f349cd0,130,明日，病院ヘ行こうと思っています。
i_3722b02f130a,130,荷物が重いので，宅配便で送ります。
i_009b40da448f,130,仕事が終わってから，飲みに行こうよ。
i_e109b95af2f9,130,ごめん。明日早いから，今日はちょっと…
i_e928cc3c7930,130,もう遅いので，そろそろ帰ろうと思います。
i_e6d71884a6ea,130,お疲れ様でした。気をつけて。
i_a194e0900dbe,130,もうすぐゴールデンウィークですね。何か予定がありますか。
i_1d0f1cfce92d,130,長江下りをしようと思っています。
i_fd5ef048cb5e,130,土曜日も仕事ですか。
i_98333dbce39a,130,ええ。香港からお客さんが来るので，空港へ迎えに行きます。
i_aae3e6ee00d5,130,今度の週末，みんなでピクニックに行こうと思っているんですが…
i_b5b25af81343,130,いいですね，どこへ行くんですか
i_7b78d65fce62,130,香山へ行こうと思います
i_8104b0c0d49d,130,森君，遅いよ
i_9e0e4648dbe9,130,すみません，出かけようとした時に，電話があったんです
i_9685780cecfc,130,そうか。それじゃ，まあ，仕方ないな。馬さん，みんなそろったから，そろそろ出発しましょうか。
i_cb737ea8df3f,130,ええ，そうしましょう。
i_60bfb4c9431e,130,近くに北京植物園があるので，帰りに寄ろうと思うんです。
i_65590da04ac8,130,いいですね，私は花が好きなので，楽しみです。
i_136ccc15c16e,130,人が多いですね。
i_e1c8e7ea8043,130,今は丁度ピクニックのシーズンですから。
i_0e839e47edfa,130,この季節は，どの行楽地も人でいっぱいですよ。
i_5e83073cf56c,130,秋の香山もいいですよ，今度は紅葉を見に来ようと思っています。
i_78c7fd9c4b1c,131,このボタンを押すと，電源が入ります。
i_f8d53ce5e9dd,131,そのパソコンは，たまにフリーズすることがあります。
i_b8b07664d774,131,馬さんはとても上手にレポートを纏めました。
i_86fc407a1462,131,李さんは来るでしょうか。
i_165c336544d1,131,すみません，市役所へはどう行くんですか。
i_ec01ae628310,131,この道をまっすぐ行くと，デパートがあります。市役所はその隣ですよ。
i_5590cfe0a4c6,131,ありがとうございます。
i_2de88afe197a,131,朝ご飯は毎日きちんと食べますか。
i_7db4315952c6,131,ええ，でも，たまに食べないことがあります。
i_97737c550d22,131,あっ，雨ですよ。
i_98fbccdfdc20,131,本当ですね，早く家に帰りましょう。
i_591f92acf2c1,131,すみません，馬さんはどちらでしょうか。
i_dedd404fbb43,131,馬さんはさっき出かけましたよ。
i_6dff1a8fab03,131,ここを曲がると小さな公園があって，子供たちがよく卓球をしているんですよ。
i_3e0d9c031920,131,卓球ですか？公園で？
i_e3e94a995d4f,131,そうです。その公園にはコンクリートでできた卓球台があるんです。
i_94edb32a7dd5,131,コンクリートの卓球台？へえ，面白いですね。
i_cdad88066668,131,ええ，卓球をしたい時にいつでもできるんです。たまに公園のそばを通ることがあるんですが，必ずだれかがやっていますね。
i_6e4662857426,131,ここから300メートルほどいくと，スポーツセンターがあります。
i_42f6b5f58cf9,131,スポーツセンター？だれでも自由に利用することができるんでしょうか。
i_601ab0f8690f,131,ええ，だれでも利用することができます。ただし，有料ですが。
i_ab2d695766b2,131,馬さんもよく利用するんですか。
i_142136e56b30,131,たまにプールで泳ぐことがあります。でも会員じゃないと夜8時以降は利用することができないんです。だから会員になろうと思っているんです。
i_e4e46163a936,131,会員になると，何か他にも特典があるんですか。
i_67b525c86c8e,131,会員の家族も安く利用することができるんです。
i_2bc1c4ec96d1,131,今何時でしょうか。
i_9c1ee473c823,131,もうすぐ1時15分になります。
i_184d58b82367,131,じゃあ，早く帰らないと，午後の会議が始まりますね。
i_e5d570f0e0ab,132,今度の日曜日に遊園地へ行くつもりです。
i_8833ca51f5d0,132,明日，友達と映画を見に行くことにしました。
i_c6d59a09c76a,132,来月から給料が上がることになりました。
i_b226e82c18e0,132,馬さんの息子さんは今年小学校に入学するそうです。
i_e2d0a3ad0ced,132,今度のボーナスで車を買うつもりです。
i_5015eb017b10,132,へえ，いいですね。
i_8608d7b626aa,132,広州へは列車で行くんですか。
i_3880ded43d10,132,いいえ，飛行機で行くことにしました。
i_e37856b0f5a5,132,李さん，出張ですか。
i_7e2b3f9d4641,132,ええ，月曜から3日間，香港へ行くことになりました。
i_d8832eb911b7,132,ニュースによると，今年の冬はインフルエンザが流行するそうです。
i_fe76a4a480e2,132,そうですか。気をつけましょうね。
i_fe9dbbd1e9a7,132,李さん，今度の連休の予定は？
i_232b645a41b1,132,小野さんを北京のいろんな所へ案内するつもりです。
i_c3928467e0ec,132,天気は大丈夫でしょうか
i_2baa455ec9ae,132,天気予報によると，連休中はずっと晴れだそうですよ。
i_35ecf95b0880,132,小野さんは，友達の太田さんの家に行くそうです。わたしも一緒に行くことになったんですが，森さんは？
i_30b9a2f0f611,132,ぼくにもメールがあって，一緒にお邪魔することにしましたよ。
i_120020db4219,132,小野さんのメールによると，太田さんの家で餃子パーティーをするそうです。だから，わたしにも手伝って欲しいって言っていました。
i_4e611ce43356,132,餃子パーティー？それはいいですね。
i_a384eeca1110,132,ところで，太田さんって，どんな人ですか？
i_fce444ea4ac8,132,北京に来てから一度会ったことがありますが，とても気さくな人ですよ。スポーツ用品の会社で，宣伝を担当しているそうです。
i_49ebf3a2380d,132,じゃあ，これから一緒に仕事をすることになるかもしれませんね。
i_453d332780e1,132,ええ，だから，できるだけ連絡を取ろうと思っています。
i_f9280a4eb696,133,電車が急に止まりました。
i_adbb3fd285e5,133,部屋の電気が消えています。
i_90e10a83b6e6,133,森さんはボーナスを全部使ってしまいました。
i_babfe7572465,133,このケーキはとてもおいしそうです。
i_7517fa286347,133,あなたが窓を開けたんですか。
i_d88d76354efa,133,いいえ，風で開いたんです。
i_abcec83a9123,133,はさみはどこですか。
i_b27b7f7db0c4,133,引き出しに入っていますよ。
i_1f818f06150e,133,おじいさんにもらった腕時計が壊れてしまいました。
i_3f6d0756b073,133,それは残念ですね。
i_be5eaad708dd,133,雨が降りそうですね。
i_7bf6c10010e8,133,じゃあ，明日の運動会は中止かもしれませんね。
i_68374c98c440,133,ちょっと早く着いてしまったけど，森さんたちはもう来ているかしら。それにしても，大勢並んでいるわね
i_aa155ad4a7bd,133,李さん！
i_c61e0d77a963,133,小野さん，お久しぶりです。
i_e48e60f0b0f4,133,本当にお久しぶり。お元気そうですね。
i_6125b0a72155,133,ええ，小野さんも。
i_9e3b31bd2e85,133,すみません，小野さん，遅刻してしまいました。
i_1a5b9107bebe,133,相変わらずですね，森さん，でも，お元気そうで，何よりです
i_7aa6e2e078f6,133,小野さん，ずいぶん重そうなスーツケースですね。
i_f571004b5d93,133,そうですか？服や小物が入っていますが，中はほとんど空ですよ。北京は初めてなので，お土産をたくさん買って，入れようと思っているんです
i_836d6d7419c0,133,あれっ，トランクが開いていないな。
i_efa59b262572,133,運転手さんに開けてもらいましょう。
i_de6ab02f6c60,134,壁にカレンダーが掛けてあります。
i_0cf58e4ac25b,134,お客さんが来る前に，部屋を掃除しておきます。
i_2011c81341e6,134,太田さんは中国語で手紙を書いてみました。
i_995f9b0c0a3a,134,日本へ留学するために，お金をためています。
i_21c0d1eff3e2,134,森さん，車をどこに止めましたか。
i_70e29bfbea43,134,公園の前に止めてあります
i_fe2e76dd2f8f,134,森さん，会議の資料はどうしますか。
i_3510c8d0160f,134,10部コピーしておいてください。
i_af41a09828b9,134,カレーライスを作ってみました。食べてみてください
i_7a6378b51cfe,134,ああ，おいしそうですね，いただきます。
i_1fab3d634e96,134,太田さん，タバコをやめたんですか。
i_e246b01ed8f1,134,ええ，健康のためにやめました。
i_40bffb292070,134,小野さんを歓迎するために，とっておきのお店を予約しておきましたよ。
i_35c055169749,134,本当？ありがとうございます。
i_5eeb5c6ef097,134,北京ダックがおいしいお店なんですよ。
i_30a82a9e9557,134,うわあ，綺麗に焼いてありますね。
i_a042ad9eec7c,134,ええ。おいしそうな色でしょう。
i_8c530ab0fae2,134,おいしい！今まで，こんなにおいしいの食べたことありません。
i_001a7114e2b2,134,本場の料理は最高でしょう？
i_012350aa461c,134,ええ，最高！今度は自分で包んでみます。
i_ac7150ce31b3,134,他にも料理はたくさん頼んでありますからね。
i_078909a4d198,134,小野さん，今日はしっかり食べておいてください。明日からハードスケジュールで，あちこち行きますからね。
i_21225e23f9d9,134,こんなに残ってしまいました。もったいないですね。
i_f66c06fde76c,134,本当ですね。じゃあ，持ち帰りにしましょう。
i_5b107d479257,134,小野さん，カラオケも予約してあるんですが，どうしますか。
i_af8271bad03c,134,もちろん行きますよ。
i_2e21f3148796,135,明日雨が降ったら，マラソン大会は中止です。
i_279df3849280,135,日本へ帰っても，中国語の勉強を続けてください。
i_7b9cd5138328,135,今年の夏休みは3日だけです。
i_d8b133232091,135,会議室には李さんしかいません。
i_45bccc8baec1,135,大学を卒業したらどうしますか。
i_bc0e1b1357be,135,外国で働きたいです。
i_1dbc8dadccef,135,馬さんは元気がないね。何かあったのかな。
i_cfff0d73f3e1,135,いくら聞いても何も言わないんだよ。
i_4d08caaecf0e,135,李さん，資料はまだできませんか。
i_c27b7a7e913e,135,すみません，あと少しだけ待ってください。
i_cdd4646ea06c,135,このゴーカートは大人でも乗ることができますか。
i_2af8fb2bb2b1,135,いいえ，子供しか乗ることができません。
i_dc1563e50c4c,135,あのう，お酒があったら，少し入れてくれませんか。
i_b5121451de70,135,1杯だけでいいですか。
i_245843a75692,135,いえ，3杯ぐらい入れてください。
i_912894c1c3cd,135,李さん，餃子を作るのが上手ですね。
i_1477ec98629c,135,ええ，北京では，餃子はどの家でも，自分たちで作って食べます。小さな子供でも上手ですよ
i_27e6268f2150,135,わたし，本のとおりに作っても，中々うまくできないんですが，どうやったらおいしくなるんでしょうか。
i_35576fc5ee19,135,何度も作ると，段々上手になりますよ。
i_f7fdd88bf6de,135,もし時間があったら，また一緒に作りましょう。
i_f15486060ec2,135,準備ができたら，乾杯しましょう
i_5c460480ed5b,135,皆さんの健康を祝って，カンパーイ！
i_f313c17fe742,135,森さん，たくさん食べますね，私はいくら頑張っても，20個ぐらいしか食べることができません。
i_b019da63126a,135,ぼくは，小野さんが作った餃子だったら，30個は大丈夫ですよ
i_18400bc819b4,136,遅くなって，すみません。
i_0538f2154a02,136,この写真はパスポートの申請に使います。
i_4bdf6dc59ce7,136,張さんは毎日お酒を飲んでばかりいます。
i_5dcdbce7df2b,136,空港の入口に警官が立っているのが見えます。
i_795d678f5c9d,136,陳さん，明日のパーティーに行きますか。
i_3726632ebd1e,136,いいえ，明日は仕事で，行くことができません。
i_c435524bb096,136,わあ，とても小さいカメラですね。
i_f76fc6cf1835,136,ええ，これは軽くて，持ち歩くのにとても便利なんですよ。
i_30304e5ae9ad,136,何で野菜ばかり食べているんですか。
i_ff68e98fad02,136,今，ダイエット中なんです。
i_afa0a21f4554,136,李さんが呼んでいたのが聞こえましたか。
i_d9f876ea03fd,136,いいえ，聞こえませんでした。
i_c048f65fe85b,136,何か変な音が聞こえませんか？
i_92756da90cf4,136,凧の音ですよ。ほら，あそこで凧を揚げているのが見えるでしょう？
i_10d84b098ace,136,あら，ほんと。凧が鳴っているのが聞こえたんですね。
i_7ff725f1d5db,136,奥さんは，北京の生活に慣れるのに苦労しましたか。
i_591a682247ea,136,ええ。とにかく最初は言葉が通じなくて，とても困りました。
i_e019968e2254,136,今はどうですか。もうぺらぺらでしょう？
i_a9cc763ff512,136,いえ，まだまだです。でも，日常会話には困りません。
i_951efb923c82,136,買い物は？
i_cc46edc73a0e,136,自分で市場へ行きますよ。市場は食べ物の他にも色々売っていて，買い物に便利ですね。
i_f611e382e1ae,136,そうですね。でも，市場は量り売りのお店が多いでしょう？
i_7170ab1399bb,136,そうなんですよ。食べ物を買うのに，知っている言い方ばかり繰り返していました。だから，卵も1斤，リンゴも1斤…
i_c953ff70b34b,136,ところで，こちらへ来てから，ご主人とどこかヘ旅行に行きましたか。
i_b198efff7fa8,136,いいえ。主人は働いてばかりで，どこへも行かないんですよ。
i_0f4070fea5b7,137,優勝すれば，オリンピックに出場することができます。
i_e5516887ac0c,137,天安門へ行くなら，地下鉄が便利ですよ。
i_7d3e44efa57a,137,映画でも見に行きませんか。
i_90be09cba015,137,パーティーで，戴さんとか楊さんとか，色々な人に会いました。
i_a0dbf3753fe7,137,陳さんの携帯電話の番号が分からないんですが…
i_34cc214cfe85,137,李さんに聞けば，分かりますよ。
i_5a9bb6baaf1a,137,李さん，プールに行きませんか。
i_21b270cc074a,137,今日はちょっと用事があるんです。明日なら暇ですが…
i_87ee04877f33,137,最近，ちょっと太りました。
i_5fdbc123d11f,137,じゃあ，運動でもしたらどうですか。
i_8d0a13fd94b2,137,葉子さん，昨日バーゲンに行ったの？
i_9541c5d26ec8,137,うん，コートとか靴とか，いっぱい買っちゃった。
i_1fda239f14a9,137,「八達嶺」までどのぐらいですか。
i_7a958a2a4fe8,137,高速道路を利用すれば，だいたい1時間ぐらいです。鉄道なら2時間ちょっとですね。
i_cb1f2547641a,137,鉄道でも行くことができるんですか。
i_96ef1ef4c171,137,ええ，鉄道で行くなら，北京北駅が便利です。直通列車が出ていますから。
i_cb0e88ee1edb,137,「八達嶺」は万里の長城の観光スポットの1つです。北京から近くて，一番有名な場所です。
i_509da1e7ac46,137,テレビとか写真集とかで見たことがありますが，実際に見ると，本当に規模が大きいですね。さすが「世界遺産」です。
i_e42865a0c246,137,どうして「万里の長城」と言うんですか。
i_da46c5e4a802,137,長城の全長は5000キロメートル以上あります。中国では「1里」は0.5キロメートルですから，中国の単位に換算すれば，1万里を超えるんですよ。
i_196388a3121b,137,何かお土産を買おうと思うんですが…
i_5f7e6fd57eb2,137,お土産なら，Tシャツとかメダルとか，色々ありますよ。
i_a44fe4e8f704,137,そうですか。じゃあ，メダルでも買おうかな。
i_0598e4f42615,137,ゆっくり探せば，他にもいいお土産があると思いますよ。
i_15e6e22eb11e,138,戴さんは英語が話せます。
i_7c2f645daed7,138,よく見えるように，大きく書きました。
i_5626b942629c,138,けがが治って，歩けるようになりました。
i_3a53abea0c4a,138,陳さんは毎日英字新聞を読むようにしています。
i_37255eb91e93,138,戴さんはお寿司が食べられますか。
i_25bd1a336f11,138,ええ，大丈夫ですよ。わたしは何でも食べられます。
i_507569d5e8eb,138,李さん，2時ごろ会社を出ますよ。
i_9a9110e10453,138,はい，いつでも出られるように，準備してあります。
i_a3611e7d0c45,138,小野さん，着物を自分で着ることができますか。
i_e7b672157411,138,ええ，母に習って，着られるようになりました。
i_5432940f9db3,138,健康のために何かしていますか。
i_f796588d1244,138,ええ，毎朝1時間散歩するようにしています。
i_7907275a7bb9,138,この路地が「胡同」ですね。
i_3322b316b4f7,138,ええ，この辺は北京の伝統的な町です。人が実際に生活している所ですから，写真は撮らないようにしてくださいね。
i_77204db50888,138,分かりました。ところで，この道は通り抜けられますか。
i_429025a3d375,138,大丈夫です。入り組んでいますが，通り抜けられますよ。
i_54f92bb75e44,138,胡同は，古い北京が感じられて，楽しいですね。
i_80d0c1322823,138,ええ。だから，時間がある時や，外国人の友達が来た時は，胡同を歩くようにしているんですよ。
i_d318f719e816,138,小野さん，「油条」は食べられますか。
i_527b2d7d0f01,138,ええ，大好きです。
i_f6897637a263,138,熱いですから，火傷しないように気をつけてくださいね。
i_423a6196a287,138,最近，マンションやビルが建って，胡同がだいぶ減ってしまいました。
i_378bd7ad448e,138,なんだか残念ですね。
i_2a590d46c180,138,そうなんです。今では胡同が見られる場所は本当に少なくなりました。
i_5cc933a47e11,139,眼鏡を掛けて本を読みます。
i_7664695b5449,139,道路工事のために，道が込んでいます。
i_e40cc8f1f887,139,李さんは急いで帰っていきました。
i_b6aed3fd6ec3,139,去年，日本で歌舞伎を見てきました。
i_7d9746738857,139,森さんは傘を持っていきましたか。
i_15af99ae6d98,139,いいえ，持たないで出かけました。
i_f36625347ced,139,李さん，遅かったですね。
i_b6a85a7d124e,139,すみません。事故があったために，電車が遅れたんです。
i_700e47e8d431,139,ずいぶんたくさん人が乗ってきましたね。
i_597303ef534a,139,ええ，丁度通勤ラッシュの時間ですから。
i_4fb2fb68bec0,139,ちょっと手紙を出してきます。
i_92d39ead7d1b,139,じゃあ，これもお願いします。
i_55bcf4c2ce86,139,この門は，昔，火事のために2度も焼けたことがあるんですよ。
i_13659c353bfa,139,そうなんですか，それにしても立派な建物ですね。中に入れるんですか。
i_179c63789a35,139,ええ，入れますよ。チケットを買ってきましょうか。
i_e2ea23de75c3,139,かばんを持って入ることができませんから，ここに預けていきましょう。
i_8f9af702a85e,139,天安門からはいろんな建物が見渡せるんですか。
i_2bd2bc04734a,139,ええ，でも今朝は霧が掛かっているために，遠くまで見えないと思いますが…。
i_8bb34d285c76,139,ここは，別名「紫禁城」と言って，映画の舞台になった所です。
i_375024c63e4c,139,そうそう。私は映画を見て，絶対来たいと思っていたんです。せっかく北京へ来て，ここを見ないで帰ることはできませんよ。
i_aaba8612fb15,139,屋根が黄色で，とても綺麗ですね。
i_4651410a5b65,139,ええ，あれは「瑠璃瓦」と言います。青い空にとてもよく合いますね。
i_e1a929dc4126,139,李さん，あの建物をバックにして，一緒に写真を撮りませんか。
i_4e9e09b7cd6f,139,いいですね。
i_a33afb4cf276,140,これから友達と食事に行くところです。
i_5cdd2b4a6ac0,140,森さんは会議の資料を揃えているところです。
i_2facd1ce2626,140,馬さんは，今，空港に着いたところです。
i_ecdbd9a2486b,140,このモノレールは去年開通したばかりです。
i_6e3ad78ecac2,140,もしもし，森さん，今どこですか。
i_0d49f2a5e60a,140,これから家を出るところです。
i_66d16ed30be4,140,森さん，上海行きの最終便は何時か分かりましたか。
i_0789ad05941a,140,今調べているところです。少し待ってください。
i_8b39380084a8,140,来月，清水さんが結婚するのを知っていますか。
i_d2479e899597,140,ええ，たった今聞いたところです。
i_db17239ebc4f,140,李さん，この本はもう読み終わりましたか。
i_a7f6fa7505ec,140,いいえ，昨日読み始めたばかりです。
i_b568ea841034,140,すみません。お待たせして。
i_75becd2e2a80,140,いいえ，私たちも丁度前に着いたところです。
i_fb81659ccc0d,140,そうですか。よかった。チケットは？
i_5975c6a33ced,140,これから買うところです。
i_dddb2191dd92,140,じゃあ，ぼくが買ってきますよ。ここで待っていてください。
i_0fe9e99ac027,140,この劇場，新しいそうですね。
i_998373d7f7f8,140,ええ，去年改築したばかりです。それまでは，清の時代にできた建物を修理しながら使い続けていました。
i_20b12961d458,140,小野さん，いかがでしたか。
i_512e11a70cf3,140,すばらしかったです。見終わったばかりで，まだ耳の奥に音楽が残っています。
i_255d2c8083d5,140,あれっ，小野さんは？
i_d285d776e741,140,小野さんなら，あそこです。今，舞台の上で，役者さんと一緒に写真を撮っているところですよ。
i_920b050fd7eb,141,李さんは部長に褒められました。
i_d4bf25ab06ac,141,馬さんは森さんにカメラを壊されました。
i_befbe3ff6546,141,陳さんは飼っていた小鳥に逃げられました。
i_a58eb9741ed0,141,2010年に上海で万博が開かれます。
i_a2133cb4b13e,141,太田君，どうしたんだ。元気がないね。
i_b1612f11d563,141,ええ。部長に叱られたんです。
i_ab1c3cd71958,141,李さん，どうしたんですか。
i_76c5509275fd,141,昨日犬に手を噛まれたんです。
i_bf7e873c0a74,141,週末にキャンプに行きました。
i_fb7900f2dee4,141,へえ。楽しかったですか。
i_15f415f53b02,141,2日とも雨に降られて，大変でしたよ。
i_8f814154ae44,141,この車のデザインはとてもいいですね。
i_bc6c461c5d3a,141,ええ。日本の有名なデザイナーによって設計されました。
i_abdfcbb89177,141,あっ，森さん，お疲れ様でした。遅かったですね。
i_000464f0e7e7,141,いやあ，参りましたよ。タクシーで帰ってきたんですが，渋滞に巻き込まれて。北京の交通事情は大変ですね。
i_93060bfb9392,141,ええ，そうなんです。わたしも毎日，バスの中で足を踏まれていますよ。
i_4a7758fa75c7,141,森さん，支社長に呼ばれて何か言われたんですか。
i_c8ef688649cc,141,ええ。ＣＳ公司から依頼された調査のレポートが遅いって，叱られました。
i_118b30051710,141,CS公司調査報告書森健太郎
i_de6d91047eba,141,昨年発売された清涼飲料水は5種類あり，最も売れているのは，中国のＡ社によって開発された「爽快」である。
i_7b357a1e7573,141,定価が最も安く，子供からお年寄りまで，幅広い世代に人気がある。
i_b99149ca2251,141,一昨年，Ａ社と日本のＢ社によって北京に合弁会社が作られ，「爽快」は昨年から大量に製造されるようになった。
i_4fa441db9425,141,製造から出荷に至るまですべてコンピューターで管理され，大幅なコストダウンが図られているため，低価格が実現できたと考えられる。…
