textId,index,content
i_0789ebcc74a9,219,お怒りはごもっともです。二度とこんなことがないように，気をつけます。何とか，契約のほうは…。
i_9a36e3a80954,219,とにかく，担当者がかんかんなんです。
i_a39d9a589f08,219,すぐにお詫びにお伺いします。
i_0ca2a5d31880,219,いいえ，わざわざ来ていただかなくて結構です。失礼します。
i_43364f6f0833,219,ま，待ってください。申し訳ありません。本当に…。
i_688f280f3303,219,東京の水道水は，かつて「まずい水」の代名詞だった。かび臭い，濁っている。などの苦情が水道局に寄せられ，浄水器を付けたり，一度沸かしてから飲んだりする人が多かった。
i_395c70dabcbb,219,ところが，この水道水が変わりつつある。東京都庁の売店には，大手飲料メーカーのミネラルウォーターのボトルの間に，都の水道局が販売する「東京水」が並ぶ。ラベルには「原材料名：水（水道水）」とある。都内の浄水場で処理した水をボトルに詰めて販売していて，味もおいしいと評判だ。この「東京水」の販売は東京都水道局が進めている「安全でおいしい水プロジェクト」キャンペーンの1つだ。
i_bf573a4d904f,219,キャンペーンでは，貯水池ならびに河川の水質管理，浄水処理施設の改善など様々な取り組みを行っている。1992年には金町浄水場（葛飾区）に，オゾンや活性炭を使って微生物などを取り除く特別な装置を導入した。更に，マンションの貯水槽や水道管が古くなって，浄水場から運ばれる水が汚染されてしまうこともあるため水道局では水道管や貯水槽を調査したり，取り替えたりしている。これらの対策が進むのに伴って，おいしくて安全な水を届けることができるようになってきた。
i_5216453dfd38,219,更に，キャンペーンの元，水源の森林を守るための取り組みも進んでいる。森林に降った雨は，地面に積もった落ち葉をゆっくりと通過し，土に染み込み，そして，川に少しずつ流れ込む。森林は，水道水の元になる綺麗な水を作る一方で，土砂がダムに流れ込まないようにする働きをしている。この「緑のダム」ともいえる森林を守り，育てることによって，いつか，ミネラルウォーターよりもおいしくて，安全な水が飲めるかもしれない。そんな期待が高まりつつある。
i_71e4f69b2103,220,どうしたんです。そんな沈んだ顔をして。
i_7384f533b801,220,あっ，李さん。どうして僕がここにいることが分かったんですか。
i_0508aa609c09,220,事務所に電話したんです。大山さんが，佐藤さんなら，外灘にいるんじゃないかって教えてくれました。
i_1e7d38b98a08,220,それで，ここが分かったんですね。
i_26381c06798d,220,私もよくここで，ぼんやり考え事をしたり，太極拳をしたりするんです。それにしても，どうしたんですか。
i_b0bc667b5a5e,220,いやあ，参りましたよ。ここのところ，失敗だらけなんです。やっと契約が取れたと思ったら，クレームが来て解約されてしまって…。
i_99f032cf22ef,220,そうだったんですか…。いろんなことがあるものですよね。でも，日本語で，何度失敗しても挫けないって，そんな諺があるじゃないですか。
i_a88e75daea10,220,「七転び八起き」ですか。
i_b5af33f3af37,220,そう。今が一番大事な時ですよ。元気を出してください。外灘の素晴らしい景色を前にしてそんなにしょんぼりしていたら，周りの人が変に思いますよ。せっかくいいニュースを持ってきたのに。
i_cb99d40a2afe,220,いいニュース？
i_92502b9d7028,220,ええ。「金星」のイメージキャラクターが，張一心に決まりました。
i_82e3d249b6b7,220,何ですって？
i_b6c42436f42f,220,張一心がCMの仕事を引き受けてくれたんです。
i_abfa5fae6aa8,220,本当ですか！？李さん，有難う。
i_3610244fe8ee,220,太極拳は歴史と伝統のある拳法である。誰もが持っている体のエネルギー詰まり「気」で戦う拳法なので，体が小さい人や，力が弱い人にも向いた護身術だといわれている。健康法としても高く評価されていて，中国の公園や広場で太極拳をする人たちをよく見かける。
i_29ef74da99c1,220,公園や広場でよく見る太極拳は，「簡化24式太極拳」と呼ばれ，元中国体育委員会が一般に広く普及させるために制定したものである。拳法というよりも寧ろ健康のための体操で，血液の循環をよくし，内臓の機能を高める。肩こり，腰痛など，体の不調ばかりでなく，ストレスを解消するのにも役立つと言われている。
i_13657d938208,220,こうした効用は世界的に認められている。アメリカやヨーロッパでも健康のために太極拳を趣味にしている人は多い。日本でも100万人以上の愛好者がいて，全国的に大きなブームになっている。「太極拳の市」として全市民で愛好している地域さえあるほどだ。日本では高齢化が進んでいるが，この市も高齢者が人口の4分の1以上を占めている。市長の提案で太極拳を推進し，市民の健康作りに役立てることにした。市は，練習所や体育館を作り，講習を行い，ラジオで毎朝35分間太極拳の音楽を放送した。そのような数々の努力が実を結び，大勢の市民が参加するようになった。実際，太極拳を始める前よりも健康になったという高齢者も多い。また，高齢者の医療，介護に関わる市の財政負担が軽減されると期待されている。
i_61f5e987b0fa,220,太極拳の「効用」は単に健康の側面だけではない。中国と日本の繋がりを強める役目も果たしている。多くの日本人が本場中国の太極拳を体験するため，中国を訪れている。また本家，中国からも太極拳の愛好者が日本に来るようになった。太極拳で日中の交流が広がっている。北京オリンピックを境に更に普及し，世界が太極拳によって心を1つにする時代が来るのではないだろうか。そんな未来も夢ではないと多くの太極拳愛好者は考えている。
i_c9fde0b53b1c,221,お客様，どんなお茶をお探しですか。よかったら，試飲なさいませんか。
i_f69954565570,221,わあ，驚いた。日本語がぺらぺらなんですね。
i_a00ffe61eb0a,221,広州には日系企業も多いですし，日本人の観光客も大勢いらっしゃいます。ですから，私も独学で日本語を勉強しました。
i_08788035dbcb,221,なるほど。本当に中国の人は勉強熱心だなあ。
i_3b5da0bd1d12,221,有難うございます。それで，どんなお茶をお探しですか。
i_7b82f5cc7204,221,じゃあ，お勧めのお茶をいくつか飲ませてくれますか。
i_7c8bbee0ef11,221,かしこまりました。少々お待ちください。
i_9e5c293991d8,221,雲南省のプーアル茶をお試してください。15年熟成させたものですから，味に深みもありますし，独特の香りがあります。お勧めですよ。
i_a3e2f5013d16,221,あっ，本当だ。確かに深い味わいですね。おいくらですか。
i_e8dd34484600,221,1斤，500gで250元です。
i_8fbba55ed495,221,うーん，結構いい値段ですねえ。
i_a269085075a9,221,こちらは15年物の特級品ですから。その分どうしてもお値段が高くなるんです。
i_740fc18065b5,221,…じゃあ，最初に飲んだウーロン茶と，このプーアル茶を350gずつください。
i_585fd8cc22b8,221,かしこまりました。えー，合わせて300元になります。
i_e55643fb5fe1,221,300元…。もう少し安くなりませんか。全部で250元でどうです。
i_e5f6cd18fe23,221,お客様，全部で250元って言うのはちょっと…。280元でどうでしょう。お負けとして，このティーバッグをサービスします。
i_babd3631bacf,221,本当？じゃあ，それでお願いします。
i_d7903ec6c4f6,221,有難うございます。今ご用意いたしますので，少々お待ちください。
i_4c63397773b7,221,中国茶はもともと薬として使われていた。疲れを取ったり，気分をすっきりさせたりする効用があるとされ，リューマチの痛みを和らげる塗り薬としても高く評価されていた。嗜好品として飲まれるようになったのは3世紀以降である。唐の時代になると広く栽培されるようになり，生産量が飛躍的に増加した。現在，中国の茶の生産量は，世界の3分の1近くを占めている。
i_863134fc357b,221,中国茶は，発酵の進み方によって香りや色が異なり，緑茶，紅茶，ウーロン茶などいくつかの種類に分けられる。すべての茶の元といわれているのが緑茶で，現在では中国各地でその土地独自の品種が育っている。
i_f2417cfc8a30,221,ジャスミン茶は茶に花の香りを付けた「花茶」の代表である。ジャスミンのほかに，金木犀の香りを付けた茶もある。ウーロン茶は福建省が産地として知られている。日本で中国茶として最も有名なのがウーロン茶で，よく飲まれているが，中国では必ずしも誰もが飲んでいるわけではない。雲南省が産地のプーアル茶は独特な香りが特徴で，体内の脂肪を流す効果がある。また血液中のコレステロールを減らして血液の循環を良くするとも言われている。
i_5c0cb24e85da,221,日本を初めヨーロッパ，中東に至るまで，茶はすべて中国から伝えられた。中国茶は，すべての茶のルーツだといっても過言ではない。「茶」という言葉の音がそれを示している。日本語では「茶」を中国と同じ「チヤ」と発音する。この「チヤ」は，ほかにもヒンディー語，アラビア語，トルコ語，ロシア語，ポルトガル語などに入った。福建地方で話される福建語の「テ」はオランダ語，ドイツ語，英語，フランス語などの言語に入って，「ティ」あるいは「テ」となった。
i_b987183b7047,221,ところで，日本に茶が伝わったのは8世紀ごろと言われるが，そのころは専ら薬として用いられた。本格的に飲まれるようになったのは，12世紀末のことである。
i_82feec541eed,222,はい，竜虎酒造上海事務所でございます。
i_e06c1328ea16,222,もしもし，私，JC企画の李秀麗と申します。いつもお世話になっております。あのう，佐藤様か大山様はいらっしゃいますか。
i_36d6aee8021f,222,あの，すみません，ちょっとお電話が遠いようなんですが…。
i_1405f3542919,222,JC企画の李秀麗と申します。佐藤様や大山様がいらっしゃいますか。
i_f1a9e2b81fa9,222,JC企画の李秀麗ですね。私，榎本と申します。申し訳ございませんが，佐藤さんと大山さんは，今広州に出張しておりまして…。
i_bfbb35bc347d,222,そうなんですか。いつお戻りですか。
i_7ba03d78e983,222,来週の水曜日の予定です。
i_80ba1a4f6df5,222,そうですか。では，伝言をお願いしたいんですが，宜しいですか。
i_587f28c633f7,222,はい，伺います。
i_7a3fe100b124,222,CM撮影のスケジュールが決まりました。来月26日と27日の2日間，場所は香港です。CM台本と撮影計画書を来週中にもお送りすると，お伝えいただけますか。
i_f0734aa37439,222,分かりました。来月26日と27日に香港で撮影。台本と撮影計画書の件ですね。確かに承りました。
i_5e94c6994fd8,222,宜しくお願いいたします。あと，1つ確認させていただきたいのですが。
i_703117da2818,222,はい。
i_39e0a108a7fd,222,撮影前の下見の際，こちらでデジタルカメラをご用意いたしますが，竜虎酒造さんでも1台ご準備いただきたいのですが…。
i_51e58843bf95,222,分かりました。その件については，佐藤に伝えておきます。
i_ef46f507383a,222,そうですか。では，宜しくお願いいたします。
i_02c0f92344f5,222,かしこまりました。お電話有難うございました。失礼いたします。
i_ad5d2864d62f,222,失礼します。
i_9f8cdb48ebbb,222,三村電気から，「MIT－7900」，2010年1月中旬より新発売！
i_459782df327b,222,「MIT－7900」は，使い易いコンパクトサイズのカメラでありながら，充実機能を満載し，写真の可能性を大きく広げる未来型のデジタルカメラです。
i_ca8d1cfe8afd,222,初心者の方も安心して美しい写真を撮影できる楽々操作。ダイヤルを合わせるだけで，綺麗な夕焼けも，美しい夜景も，迫力の打ち上げ花火も思いいのままに撮影できます。また，新聞発レンズの採用により。更に，動画撮影機能も搭載しており，どんなシーンも思いい通りに美しく撮影することができます。
i_08c9961f1c99,222,思いい出の一枚を高画質で撮れることに加え，操作のしやすさも充実しています。「MIT－7900」は，カメラを持った状態で片手で簡単に操作できるよう，撮影時や再生時に使うボタンやレバーの配置は工夫されています。1回の充電で350枚の長時間撮影が可能。乾電池も使用することができ。外出先でも安心です。
i_c757c6ecdeec,222,「MIT－7900」は，手のひらに乗る約180gの小型軽量，スタイリッシュで持ち易い形とサイズ。ボディには人気のアルミ素材を使用しており，使うたびに愛着が深まる，こだわりのデザインです。
i_00038db19817,222,色は，シルバー，ブラック，ピンクの3色。メモリカード，充電用電池，パソコン接続用のケーブルがセットになっています。
i_345d4a31a202,222,あなたの使い方次第で豊かなデジタルライフがお楽しみいただけます。
i_50a8a1616f0c,223,綺麗だな。瓦屋根の家が水に映って，丸で大きな絵を見ているようだ。あのう小さな船は，なんと言うんですか。
i_76aae4cf2c65,223,烏篷船です。紹興酒の甕を積んで運ぶ伝統的な船です。
i_9584e7e83e0c,223,紹興酒を運ぶ船ですか。
i_1c8936103d7e,223,ええ。紹興で酒づくりが始まったのは，今から2500年前，春秋戦国時代だと言われています。紹興酒は，それ以来ほとんど変わらない手法で作られているんです。
i_c40b84788bde,223,なるほど。あの味は長い伝統の味なんですね。
i_a17c4693e565,223,紹興には，「鑒湖の水」と言うおいしい水と，中国で1番おいしいお米があります。そんな土地だからこそ，2500年もの間，酒作りが栄えたんでしょう。
i_5df484a93198,223,水と米か。日本酒と同じですね。
i_02546943a9ad,223,お客様，紹興は初めてでいらっしゃいますか。
i_5f1213b37236,223,いいえ。10年前，学生時代に1度来たことがあるんです。あのころは，まさか自分が酒造会社に就職するとは思ってみなかったなあ。
i_4a10c001f06b,223,酒造関係のお仕事をされているんですか。でしたら，「鑒湖」に面した紹興酒工場にもご案内しましょうか。
i_5e130e2759a9,223,いいですね。ぜひ行って見たいです。
i_517352f3d627,223,そうそう，工場の近くには魯迅の愛した店「咸亨酒店」もございますよ。魯迅，ご存知ですか。
i_e37ab439153a,223,もちろん，中学校の教科書にも載っているくらい，日本でも有名です。
i_26dbc9f18b83,223,そうですか。では，後ほど魯迅記念館にも立ち寄りましょう。では，参りましょうか。
i_e59852732edc,223,水郷の町と言えば「江南古鎮」が1番だ。江南とは長江下流の南岸，古鎮とは古い町の意味である。烏鎮，周荘，西塘，同里，朱家角などを指し，城を待たない水上都市として，明から清の時代にかけて大きく発展した。運河に沿って続く古鎮の風景は，1年通じてそれぞれに魅力があるが，初春の風景はひときわ素晴らしい。水郷ならではの景色と素朴な暮らしが見られる。
i_b6402d4d4e2b,223,古鎮の路地は一般に狭くて長い。石畳の細い小道が古い建物の間を延々と続く。特に烏鎮の路地は必見だ。またこの町の「昆劇」や「越劇」などの伝統劇は人気が高い。周荘の運河巡りはぜひとも体験したい。船頭の歌う歌を聞きながら，元，明，清の時代に建てられた14の橋を巡る。この町の建物の内，6割は明清の時代に建てられたもので，特に，清の時代に建てられた「瀋庁」の柱や門に施された彫刻は傑作だ。西塘では，運河沿いに日差しや雨風を避けるためのひさしが付いた1キロにも及ぶ長い道に目を見張ることだろう。
i_f5254af7f16a,223,同里には古い橋と明清時代の建築が多い。見所は世界遺産に登録されている富豪の家「退思園」だ。清の終わりに作られた林のような庭園は江南庭園の代表するもので，その美しさは見飽きることがない。
i_d0c0eb44708a,223,朱家角の北大街の商店街が楽しい。明清時代の雰囲気が色濃く残っている道幅の狭い商店街で，両側の屋根の間から空が細い線のように見えること「一線街」と言われている。町の北東に掛かる「放生橋」は朱家角のシンボルになっている。
i_74b1d06ff76d,223,「江南古鎮」への観光は，上海，杭州，蘇州から出発する。烏鎮，周荘，西塘，朱家角へは上海から，同里へは蘇州からのアクセスが便利だ。
i_68976749044a,224,すごい。これが100万ドルの夜景か。なんて素晴らしいんだろう。
i_76316b5c688c,224,わあ，綺麗！素晴らしい眺めですね。
i_8a65e1653c2d,224,香港が「東方の真珠」と呼ばれる理由が分かりましたよ。
i_7e5748d04177,224,CMは，このビクトリアピークで撮影する予定です。いかがでしょうか？
i_06708507d5e5,224,ちょっと1つ気になったんですが，山頂で夜景を眺めながら乾杯するというのは，不自然じゃないですか。
i_d17f3ae7afe4,224,そう言われてみると，そうですね…。何かいい案はないものでしょうか。
i_31f5ed63c916,224,こんなのはどうでしょう。場面をナイトクルージングにして，船の上から夜景を見て，乾杯をするというのは。
i_10f13dd91c72,224,いいですね。香港というと，やはり夜景を外すわけにはいきませんから。
i_52624c05dc7a,224,夜景と恋人たち，海上で停泊する船の上で恋人たちが乾杯する…。
i_12e04eb449ac,224,それなら，張一心のイメージにもびったりです。
i_b16ed7b5a7a3,224,もしかすると，最後に2人が「金星」カクテルで乾杯するというのをやめてもいいかもしれません。こんなに綺麗な夜景を前にしたら，恋人たちにはお酒もプレゼントもいらない気がします。
i_5f76014f8190,224,商品を一切登場させないで，最後に「金星」の文字が映るだけというほうが，確かに印象は強烈かもしれません。
i_0354c1c64ec8,224,早速シナリオを修正します。
i_68fdc675c2f6,224,宜しくお願いします。
i_f249d61a46a3,224,一般の視聴者にとって，CMは迷惑なものと考えられがちだ。確かに，スポーツの緊迫した試合や感動的なドラマがCMで中断されたりすると，そう思ってしまうのも無理はない。しかし，ほぼすべての放送局は広告収入によって運営されている。従って，番組そのものよりも，CMを見てもらうことこそが放送の目的だといっても言い過ぎではない。
i_49812de7e56c,224,そうは言っても，視聴者が，企業の広告ではなく番組のためにテレビを見る以上，広告主の企業や放送局と視聴者の利害は常に対立することになる。CMを見せる側は，あの手この手を使って，何とか嫌がる視聴者がチャンネルを変えないように努力しなければならないわけだ。
i_61d2f8da69f2,224,例えば，{商品名|しょうひんめい}や企業名は，普通に言うよりも歌にしたほうが記憶に残り易い。そこでCMソングが生まれる。知らない人よりも知っている人が商品を紹介したほうが親しみ易い。そこで，人気タレントをCMに起用する。実際，世界の超一流スターや歌手がCMに出演することさえ珍しくない。また，これとは逆に，CM出演によって有名な俳優や，CMに使われたのがきっかけでヒットする歌も少なくない。1日に何度も放送されるから，知らず知らずのうちに顔やメロディを覚えてしまうのである。
i_20e1f44cbcfb,224,日本ではCMのコンテストがしばしば開催されている。それらに入賞するCMの中には，15秒や30秒という短い時間に見事なドラマを作り上げているものや，映像表現として優れたものも多い。また，企業の会社の貢献を紹介したり，環境問題などについての社会的なメッセージを発信したりするCMも増えている。これらは，商品の宣伝を直接的に訴えるというよりも，企業イメージそのものを伝えるためのCMといってよいだろう。
i_6452c0b3a05f,224,CMとは，わずか1分足らずの時間のために，莫大な手間と費用をかけて作られた映像作品なのだ。
i_93b0e5eb5a18,225,創作中華料理コンテストの選考会場が，上海ノートホテルに決まりました。選考会当日は，日本のテレビ局も取材に来ます。更に，張一心もゲスト審査員として出席の予定です。
i_9a904f26021b,225,やった！ついに「金星」プロジェクトがここまで来たぞ。
i_86c3650652bf,225,李さんたちのおかげです。カクテルの売り込みのことといい，張一心のCM起用といい，何とお礼を言っていいか分かりません。本当に有難うございました。
i_32dfb1ea7ff6,225,いいえ，皆様の努力の結果です。私たちは，お手伝いをしただけです。
i_e2565becf24e,225,おかげさまで，今回の創作中華料理コンテストには，全国から10
i_d07aaee9db35,225,本当ですか。それはすごい。
i_8eb5afdc0aa3,225,どのメニューも工夫されたものばかりです。中華風の寿司といったものから，日本酒を使ったデザートなんていうものもありました。
i_9bb64fa2ca46,225,楽しみだなあ。それにしても，よく会場を押さえられましたよね。
i_891ee6390c76,225,ええ。CMの評判はもちろんですが，上海随一の料理店，水都酒楼が協力してくれたのも大きかったと思います。総料理長の陳さんは有名な特級調理師ですし。
i_be366eb8dfc1,225,特級調理師って？
i_5ea5bd56ed86,225,一流のシェフとして国から認められた料理人のことです。中国では，料理人の腕前は国家の認定制度でランクづけがされていて，最も位の高い特級調理師は全国で数百人しかいません。李主任が陳さんのところに何度も足を運んでやっと引き受けてもらえましたよ。
i_bedeffdcc981,225,ええっ，李さん，そんなことまでしてくれていたんですか。
i_10adb53be211,225,これが私たちの仕事ですから。
i_02023179c56f,225,李さん，ここまで来られたのは，李さんたちのおかげです。心からお礼を言います。
i_c914750686e4,225,とんでもありません。
i_a75c6349168c,225,今，世界中で寿司が大人気だ。中国を初めとしたアジアの国々，ヨーロッパ，アメリカ，中東，ロシアなどにも，数えきれないほどの日本食レストランがある。また，大都市のスーパーでは巻き寿司や握り寿司が普通に売られている。中国には，北京，上海などの大都市はもちろん，小さな地方都市にも寿司屋がある。長い間，生の魚を食べる習慣がなかったが，最近では生魚の寿司を好む人も多くなってきている。
